{
  "$schema": "https://json-schema.org/draft/2020-12/schema",
  "$id": "urn:tabellio:schema:product-design-profile:v0.1",
  "title": "Tabellio Product Design Profile",
  "type": "object",
  "additionalProperties": false,
  "required": ["schemaVersion", "productId", "title", "audience", "platforms", "visualThesis", "sources", "referenceLock", "policy", "baselines"],
  "properties": {
    "schemaVersion": {"const": "tabellio-product-design/v0.1"},
    "productId": {"type": "string", "minLength": 1},
    "title": {"type": "string", "minLength": 1},
    "audience": {"type": "array", "minItems": 1, "maxItems": 20, "items": {"type": "string", "minLength": 1}},
    "platforms": {"type": "array", "minItems": 1, "uniqueItems": true, "items": {"enum": ["web", "ios", "android", "desktop", "email", "docs"]}},
    "visualThesis": {"type": "string", "minLength": 1, "maxLength": 1000},
    "sources": {
      "type": "object",
      "additionalProperties": false,
      "required": ["tokens", "components", "decisions"],
      "properties": {
        "tokens": {"$ref": "#/$defs/sources"},
        "components": {"$ref": "#/$defs/sources"},
        "decisions": {"type": "array", "maxItems": 100, "items": {"$ref": "#/$defs/path"}}
      }
    },
    "referenceLock": {
      "type": "object",
      "additionalProperties": false,
      "required": ["primary", "preserve", "borrow", "roleRules", "reject", "mediaStrategy"],
      "properties": {
        "primary": {"type": "string", "minLength": 1},
        "preserve": {"type": "array", "minItems": 1, "maxItems": 20, "items": {"type": "string", "minLength": 1}},
        "borrow": {"type": "array", "maxItems": 20, "items": {"type": "string", "minLength": 1}},
        "roleRules": {"type": "array", "maxItems": 30, "items": {"type": "string", "minLength": 1}},
        "reject": {"type": "array", "minItems": 1, "maxItems": 30, "items": {"type": "string", "minLength": 1}},
        "mediaStrategy": {"type": "string", "minLength": 1, "maxLength": 1000}
      }
    },
    "policy": {
      "type": "object",
      "additionalProperties": false,
      "required": ["themes", "viewports", "states", "surfaces", "forbiddenPatterns", "accessibility"],
      "properties": {
        "themes": {"type": "array", "minItems": 1, "uniqueItems": true, "items": {"enum": ["light", "dark", "high-contrast"]}},
        "viewports": {"type": "array", "minItems": 1, "maxItems": 20, "items": {"$ref": "#/$defs/viewport"}},
        "states": {"type": "array", "minItems": 1, "maxItems": 50, "uniqueItems": true, "items": {"type": "string", "minLength": 1}},
        "surfaces": {"type": "array", "minItems": 1, "maxItems": 100, "items": {"$ref": "#/$defs/surface"}},
        "forbiddenPatterns": {"type": "array", "maxItems": 100, "items": {"type": "string", "minLength": 1}},
        "accessibility": {
          "type": "object",
          "additionalProperties": false,
          "required": ["standard", "keyboardRequired", "reducedMotionRequired"],
          "properties": {
            "standard": {"type": "string", "minLength": 1},
            "keyboardRequired": {"type": "boolean"},
            "reducedMotionRequired": {"type": "boolean"}
          }
        }
      }
    },
    "baselines": {
      "type": "object",
      "additionalProperties": false,
      "required": ["manifest"],
      "properties": {"manifest": {"$ref": "#/$defs/path"}}
    }
  },
  "$defs": {
    "path": {"type": "string", "minLength": 1, "not": {"pattern": "^(?:/|[A-Za-z]:[\\\\/])|(?:^|[\\\\/])\\.\\.(?:[\\\\/]|$)"}},
    "source": {
      "type": "object",
      "additionalProperties": false,
      "required": ["path", "digest"],
      "properties": {"path": {"$ref": "#/$defs/path"}, "digest": {"type": "string", "pattern": "^[0-9a-f]{64}$"}}
    },
    "sources": {"type": "array", "minItems": 1, "maxItems": 100, "items": {"$ref": "#/$defs/source"}},
    "surface": {
      "type": "object",
      "additionalProperties": false,
      "required": ["id", "kind", "target", "viewports", "themes", "states"],
      "properties": {
        "id": {"type": "string", "minLength": 1},
        "kind": {"enum": ["route", "component"]},
        "target": {"type": "string", "minLength": 1},
        "viewports": {"type": "array", "minItems": 1, "uniqueItems": true, "items": {"type": "string", "minLength": 1}},
        "themes": {"type": "array", "minItems": 1, "uniqueItems": true, "items": {"enum": ["light", "dark", "high-contrast"]}},
        "states": {"type": "array", "minItems": 1, "uniqueItems": true, "items": {"type": "string", "minLength": 1}}
      }
    },
    "viewport": {
      "type": "object",
      "additionalProperties": false,
      "required": ["id", "width", "height", "deviceScaleFactor"],
      "properties": {
        "id": {"type": "string", "minLength": 1},
        "width": {"type": "integer", "minimum": 240, "maximum": 7680},
        "height": {"type": "integer", "minimum": 240, "maximum": 7680},
        "deviceScaleFactor": {"type": "number", "minimum": 0.5, "maximum": 4}
      }
    }
  }
}
